{
  "$schema": "http://json-schema.org/draft-07/schema#",
  "$comment": "GENERATED by gui/schema-gen/derive_nf_config_schemas.py from config/udr.json + its source (ADR-0425). Do not edit; regenerate.",
  "title": "udr",
  "type": "object",
  "additionalProperties": false,
  "properties": {
    "port": {
      "type": "integer",
      "x-cpp-type": "unsigned short"
    },
    "sbi_bind_address": {
      "type": "string",
      "x-cpp-type": "std::string"
    },
    "advertised_ipv4": {
      "type": "string",
      "x-env-override": "UDR_ADVERTISED_IPV4",
      "x-cpp-type": "std::string"
    },
    "metrics_bind_address": {
      "type": "string",
      "x-cpp-type": "std::string"
    },
    "nrf_base_url": {
      "type": "string",
      "x-env-override": "UDR_NRF_BASE_URL",
      "x-cpp-type": "std::string"
    },
    "database_url": {
      "type": "string",
      "x-env-override": "UDR_DATABASE_URL",
      "x-cpp-type": "std::string",
      "x-sensitivity": "credential"
    },
    "oam_provisioning_allowed_clients": {
      "type": "array",
      "items": {
        "type": "string"
      }
    },
    "oauth2_required": {
      "type": "boolean",
      "x-env-override": "UDR_OAUTH2_REQUIRED",
      "x-cpp-type": "bool"
    }
  },
  "required": [
    "advertised_ipv4",
    "database_url",
    "metrics_bind_address",
    "nrf_base_url",
    "port",
    "sbi_bind_address"
  ],
  "x-config-file": "config/udr.json",
  "x-source": [
    "nfs/udr"
  ],
  "x-apply": "restart",
  "x-review": [
    "oam_provisioning_allowed_clients: present in the file but no source line visibly reads it"
  ]
}
