{
  "port": 7781,
  "sbi_bind_address": "0.0.0.0",
  "advertised_ipv4": "127.0.0.1",
  "metrics_bind_address": "0.0.0.0:9468",
  "nrf_base_url": "https://127.0.0.1:7777",
  "database_url": "postgresql://udr:udr@localhost:5437/udr",
  "oam_provisioning_allowed_clients": [
    "provisioning"
  ],
  "oauth2_required": true
}
