{
  "port": 7781,
  "sbi_bind_address": "0.0.0.0",
  "advertised_ipv4": "auto",
  "metrics_bind_address": "0.0.0.0:9468",
  "nrf_base_url": "https://nrf:7777",
  "database_url": "postgresql://udr:udr@postgres-udr:5432/udr",
  "oam_provisioning_allowed_clients": [
    "provisioning"
  ],
  "oauth2_required": true
}
